{
  "$schema": "http://json-schema.org/draft-07/schema#",
  "title": "Glugent config",
  "type": "object",
  "properties": {
    "$schema": { "type": "string" },
    "sections": {
      "type": "object",
      "description": "Where section files (Markdown + {{props}}) live. Globs are relative to this config file.",
      "properties": {
        "include": { "type": "array", "items": { "type": "string" }, "default": ["**/*.ggen.md"] },
        "exclude": { "type": "array", "items": { "type": "string" } },
        "root": { "type": "string", "description": "Section ids are computed relative to this directory (default: the config directory)." }
      },
      "additionalProperties": false
    },
    "targets": {
      "type": "object",
      "description": "Where target definition files (JSON) live: `*.target.ggen.json`, `*.agent.ggen.json` or `*.doc.ggen.json` by default.",
      "properties": {
        "include": { "type": "array", "items": { "type": "string" }, "default": ["**/*.{target,agent,doc}.ggen.json"] },
        "exclude": { "type": "array", "items": { "type": "string" } }
      },
      "additionalProperties": false
    },
    "agents": {
      "type": "object",
      "description": "Deprecated alias of `targets`; both are read and merged.",
      "properties": {
        "include": { "type": "array", "items": { "type": "string" }, "default": ["**/*.agent.ggen.json"] },
        "exclude": { "type": "array", "items": { "type": "string" } }
      },
      "additionalProperties": false
    },
    "props": {
      "type": "object",
      "description": "Project-wide props. They override agent props but are overridden by CLI --set.",
      "additionalProperties": { "type": ["string", "number", "boolean"] }
    },
    "outDir": { "type": "string", "default": "dist/agents", "description": "Default output directory for built agents." }
  },
  "additionalProperties": false
}
